[
  {
    "year": 2025,
    "province": "山东",
    "score": 750,
    "rank": 1,
    "batch_category": "物理类"
  },
  {
    "year": 2025,
    "province": "山东",
    "score": 749,
    "rank": 1001,
    "batch_category": "物理类"
  },
  {
    "year": 2025,
    "province": "山东",
    "score": 748,
    "rank": 2001,
    "batch_category": "物理类"
  },
  {
    "year": 2025,
    "province": "山东",
    "score": 747,
    "rank": 3001,
    "batch_category": "物理类"
  },
  {
    "year": 2025,
    "province": "山东",
    "score": 746,
    "rank": 4001,
    "batch_category": "物理类"
  },
  {
    "year": 2025,
    "province": "山东",
    "score": 745,
    "rank": 5001,
    "batch_category": "物理类"
  },
  {
    "year": 2025,
    "province": "山东",
    "score": 744,
    "rank": 6001,
    "batch_category": "物理类"
  },
  {
    "year": 2025,
    "province": "山东",
    "score": 743,
    "rank": 7001,
    "batch_category": "物理类"
  },
  {
    "year": 2025,
    "province": "山东",
    "score": 742,
    "rank": 8001,
    "batch_category": "物理类"
  },
  {
    "year": 2025,
    "province": "山东",
    "score": 741,
    "rank": 9001,
    "batch_category": "物理类"
  },
  {
    "year": 2025,
    "province": "山东",
    "score": 740,
    "rank": 10001,
    "batch_category": "物理类"
  },
  {
    "year": 2025,
    "province": "山东",
    "score": 739,
    "rank": 11001,
    "batch_category": "物理类"
  },
  {
    "year": 2025,
    "province": "山东",
    "score": 738,
    "rank": 12001,
    "batch_category": "物理类"
  },
  {
    "year": 2025,
    "province": "山东",
    "score": 737,
    "rank": 13001,
    "batch_category": "物理类"
  },
  {
    "year": 2025,
    "province": "山东",
    "score": 736,
    "rank": 14001,
    "batch_category": "物理类"
  },
  {
    "year": 2025,
    "province": "山东",
    "score": 735,
    "rank": 15001,
    "batch_category": "物理类"
  },
  {
    "year": 2025,
    "province": "山东",
    "score": 734,
    "rank": 16001,
    "batch_category": "物理类"
  },
  {
    "year": 2025,
    "province": "山东",
    "score": 733,
    "rank": 17001,
    "batch_category": "物理类"
  },
  {
    "year": 2025,
    "province": "山东",
    "score": 732,
    "rank": 18001,
    "batch_category": "物理类"
  },
  {
    "year": 2025,
    "province": "山东",
    "score": 731,
    "rank": 19001,
    "batch_category": "物理类"
  },
  {
    "year": 2025,
    "province": "山东",
    "score": 730,
    "rank": 20001,
    "batch_category": "物理类"
  },
  {
    "year": 2025,
    "province": "山东",
    "score": 729,
    "rank": 21001,
    "batch_category": "物理类"
  },
  {
    "year": 2025,
    "province": "山东",
    "score": 728,
    "rank": 22001,
    "batch_category": "物理类"
  },
  {
    "year": 2025,
    "province": "山东",
    "score": 727,
    "rank": 23001,
    "batch_category": "物理类"
  },
  {
    "year": 2025,
    "province": "山东",
    "score": 726,
    "rank": 24001,
    "batch_category": "物理类"
  },
  {
    "year": 2025,
    "province": "山东",
    "score": 725,
    "rank": 25001,
    "batch_category": "物理类"
  },
  {
    "year": 2025,
    "province": "山东",
    "score": 724,
    "rank": 26001,
    "batch_category": "物理类"
  },
  {
    "year": 2025,
    "province": "山东",
    "score": 723,
    "rank": 27001,
    "batch_category": "物理类"
  },
  {
    "year": 2025,
    "province": "山东",
    "score": 722,
    "rank": 28001,
    "batch_category": "物理类"
  },
  {
    "year": 2025,
    "province": "山东",
    "score": 721,
    "rank": 29001,
    "batch_category": "物理类"
  },
  {
    "year": 2025,
    "province": "山东",
    "score": 720,
    "rank": 30001,
    "batch_category": "物理类"
  },
  {
    "year": 2025,
    "province": "山东",
    "score": 719,
    "rank": 31001,
    "batch_category": "物理类"
  },
  {
    "year": 2025,
    "province": "山东",
    "score": 718,
    "rank": 32001,
    "batch_category": "物理类"
  },
  {
    "year": 2025,
    "province": "山东",
    "score": 717,
    "rank": 33001,
    "batch_category": "物理类"
  },
  {
    "year": 2025,
    "province": "山东",
    "score": 716,
    "rank": 34001,
    "batch_category": "物理类"
  },
  {
    "year": 2025,
    "province": "山东",
    "score": 715,
    "rank": 35001,
    "batch_category": "物理类"
  },
  {
    "year": 2025,
    "province": "山东",
    "score": 714,
    "rank": 36001,
    "batch_category": "物理类"
  },
  {
    "year": 2025,
    "province": "山东",
    "score": 713,
    "rank": 37001,
    "batch_category": "物理类"
  },
  {
    "year": 2025,
    "province": "山东",
    "score": 712,
    "rank": 38001,
    "batch_category": "物理类"
  },
  {
    "year": 2025,
    "province": "山东",
    "score": 711,
    "rank": 39001,
    "batch_category": "物理类"
  },
  {
    "year": 2025,
    "province": "山东",
    "score": 710,
    "rank": 40001,
    "batch_category": "物理类"
  },
  {
    "year": 2025,
    "province": "山东",
    "score": 709,
    "rank": 41001,
    "batch_category": "物理类"
  },
  {
    "year": 2025,
    "province": "山东",
    "score": 708,
    "rank": 42001,
    "batch_category": "物理类"
  },
  {
    "year": 2025,
    "province": "山东",
    "score": 707,
    "rank": 43001,
    "batch_category": "物理类"
  },
  {
    "year": 2025,
    "province": "山东",
    "score": 706,
    "rank": 44001,
    "batch_category": "物理类"
  },
  {
    "year": 2025,
    "province": "山东",
    "score": 705,
    "rank": 45001,
    "batch_category": "物理类"
  },
  {
    "year": 2025,
    "province": "山东",
    "score": 704,
    "rank": 46001,
    "batch_category": "物理类"
  },
  {
    "year": 2025,
    "province": "山东",
    "score": 703,
    "rank": 47001,
    "batch_category": "物理类"
  },
  {
    "year": 2025,
    "province": "山东",
    "score": 702,
    "rank": 48001,
    "batch_category": "物理类"
  },
  {
    "year": 2025,
    "province": "山东",
    "score": 701,
    "rank": 49001,
    "batch_category": "物理类"
  },
  {
    "year": 2025,
    "province": "山东",
    "score": 700,
    "rank": 50001,
    "batch_category": "物理类"
  },
  {
    "year": 2025,
    "province": "山东",
    "score": 699,
    "rank": 51001,
    "batch_category": "物理类"
  },
  {
    "year": 2025,
    "province": "山东",
    "score": 698,
    "rank": 52001,
    "batch_category": "物理类"
  },
  {
    "year": 2025,
    "province": "山东",
    "score": 697,
    "rank": 53001,
    "batch_category": "物理类"
  },
  {
    "year": 2025,
    "province": "山东",
    "score": 696,
    "rank": 54001,
    "batch_category": "物理类"
  },
  {
    "year": 2025,
    "province": "山东",
    "score": 695,
    "rank": 55001,
    "batch_category": "物理类"
  },
  {
    "year": 2025,
    "province": "山东",
    "score": 694,
    "rank": 56001,
    "batch_category": "物理类"
  },
  {
    "year": 2025,
    "province": "山东",
    "score": 693,
    "rank": 57001,
    "batch_category": "物理类"
  },
  {
    "year": 2025,
    "province": "山东",
    "score": 692,
    "rank": 58001,
    "batch_category": "物理类"
  },
  {
    "year": 2025,
    "province": "山东",
    "score": 691,
    "rank": 59001,
    "batch_category": "物理类"
  },
  {
    "year": 2025,
    "province": "山东",
    "score": 690,
    "rank": 60001,
    "batch_category": "物理类"
  },
  {
    "year": 2025,
    "province": "山东",
    "score": 689,
    "rank": 61001,
    "batch_category": "物理类"
  },
  {
    "year": 2025,
    "province": "山东",
    "score": 688,
    "rank": 62001,
    "batch_category": "物理类"
  },
  {
    "year": 2025,
    "province": "山东",
    "score": 687,
    "rank": 63001,
    "batch_category": "物理类"
  },
  {
    "year": 2025,
    "province": "山东",
    "score": 686,
    "rank": 64001,
    "batch_category": "物理类"
  },
  {
    "year": 2025,
    "province": "山东",
    "score": 685,
    "rank": 65001,
    "batch_category": "物理类"
  },
  {
    "year": 2025,
    "province": "山东",
    "score": 684,
    "rank": 66001,
    "batch_category": "物理类"
  },
  {
    "year": 2025,
    "province": "山东",
    "score": 683,
    "rank": 67001,
    "batch_category": "物理类"
  },
  {
    "year": 2025,
    "province": "山东",
    "score": 682,
    "rank": 68001,
    "batch_category": "物理类"
  },
  {
    "year": 2025,
    "province": "山东",
    "score": 681,
    "rank": 69001,
    "batch_category": "物理类"
  },
  {
    "year": 2025,
    "province": "山东",
    "score": 680,
    "rank": 70001,
    "batch_category": "物理类"
  },
  {
    "year": 2025,
    "province": "山东",
    "score": 679,
    "rank": 71001,
    "batch_category": "物理类"
  },
  {
    "year": 2025,
    "province": "山东",
    "score": 678,
    "rank": 72001,
    "batch_category": "物理类"
  },
  {
    "year": 2025,
    "province": "山东",
    "score": 677,
    "rank": 73001,
    "batch_category": "物理类"
  },
  {
    "year": 2025,
    "province": "山东",
    "score": 676,
    "rank": 74001,
    "batch_category": "物理类"
  },
  {
    "year": 2025,
    "province": "山东",
    "score": 675,
    "rank": 75001,
    "batch_category": "物理类"
  },
  {
    "year": 2025,
    "province": "山东",
    "score": 674,
    "rank": 76001,
    "batch_category": "物理类"
  },
  {
    "year": 2025,
    "province": "山东",
    "score": 673,
    "rank": 77001,
    "batch_category": "物理类"
  },
  {
    "year": 2025,
    "province": "山东",
    "score": 672,
    "rank": 78001,
    "batch_category": "物理类"
  },
  {
    "year": 2025,
    "province": "山东",
    "score": 671,
    "rank": 79001,
    "batch_category": "物理类"
  },
  {
    "year": 2025,
    "province": "山东",
    "score": 670,
    "rank": 80001,
    "batch_category": "物理类"
  },
  {
    "year": 2025,
    "province": "山东",
    "score": 669,
    "rank": 81001,
    "batch_category": "物理类"
  },
  {
    "year": 2025,
    "province": "山东",
    "score": 668,
    "rank": 82001,
    "batch_category": "物理类"
  },
  {
    "year": 2025,
    "province": "山东",
    "score": 667,
    "rank": 83001,
    "batch_category": "物理类"
  },
  {
    "year": 2025,
    "province": "山东",
    "score": 666,
    "rank": 84001,
    "batch_category": "物理类"
  },
  {
    "year": 2025,
    "province": "山东",
    "score": 665,
    "rank": 85001,
    "batch_category": "物理类"
  },
  {
    "year": 2025,
    "province": "山东",
    "score": 664,
    "rank": 86001,
    "batch_category": "物理类"
  },
  {
    "year": 2025,
    "province": "山东",
    "score": 663,
    "rank": 87001,